{
  "$schema": "http://json-schema.org/draft-07/schema#", "title": "Planned write seat outcome",
  "type": "object", "additionalProperties": false,
  "required": ["schema_version", "artifact_type", "producer_role", "issue", "round", "manifest_revision", "plan_revision", "seat_id", "source_head", "changed_paths", "status", "created_at", "closure_binding"],
  "properties": {
    "schema_version": { "const": "1" }, "artifact_type": { "const": "seat_outcome" }, "producer_role": { "const": "CONDUCTOR" },
    "issue": { "type": "integer", "minimum": 1 }, "round": { "type": "integer", "minimum": 1 }, "manifest_revision": { "type": "integer", "minimum": 1 }, "plan_revision": { "type": "integer", "minimum": 1 },
    "seat_id": { "type": "string", "minLength": 1 }, "source_head": { "type": "string", "pattern": "^[0-9a-f]{40}$" },
    "changed_paths": { "type": "array", "uniqueItems": true, "items": { "type": "string", "minLength": 1 } }, "status": { "enum": ["pass", "fail"] }, "created_at": { "type": "string", "pattern": "^\\d{4}-\\d{2}-\\d{2}T\\d{2}:\\d{2}:\\d{2}(?:\\.\\d+)?(?:Z|[+-]\\d{2}:\\d{2})$" },
    "closure_binding": { "$ref": "#/definitions/closure_binding" }
  },
  "definitions": {
    "closure_binding": { "type": "object", "additionalProperties": false, "required": ["issue", "round", "manifest_revision", "plan_revision", "candidate_head", "attempt_id", "generated_at"], "properties": {
      "issue": { "type": "integer", "minimum": 1 }, "round": { "type": "integer", "minimum": 1 }, "manifest_revision": { "type": "integer", "minimum": 1 }, "plan_revision": { "type": "integer", "minimum": 1 },
      "candidate_head": { "type": "string", "pattern": "^[0-9a-f]{40}$" }, "attempt_id": { "type": "string", "pattern": "^[A-Za-z0-9][A-Za-z0-9._-]*$" },
      "generated_at": { "type": "string", "pattern": "^\\d{4}-\\d{2}-\\d{2}T\\d{2}:\\d{2}:\\d{2}(?:\\.\\d+)?(?:Z|[+-]\\d{2}:\\d{2})$" }
    } }
  }
}
