{"schema_version":"1","artifact_type":"seat_outcome","producer_role":"CONDUCTOR","issue":14,"round":1,"manifest_revision":1,"plan_revision":1,"seat_id":"api","source_head":"aaaaaaaaaaaaaaaaaaaaaaaaaaaaaaaaaaaaaaaa","changed_paths":["src/api/file.js"],"status":"pass","created_at":"2026-07-21T00:00:00Z","closure_binding":{"issue":14,"round":1,"manifest_revision":1,"plan_revision":1,"candidate_head":"aaaaaaaaaaaaaaaaaaaaaaaaaaaaaaaaaaaaaaaa","attempt_id":"attempt-1","generated_at":"2026-07-21T00:00:00Z"}}
